{
  "messageId": "0192a1b2-0000-7000-8000-00000000a001",
  "messageKind": "event",
  "messageType": "InventoryLowStock",
  "messageVersion": 1,
  "producer": "ecommerce-inventory-service",
  "occurredAt": "2026-10-13T09:30:00.000Z",
  "correlationId": "0192a1b2-0000-7000-8000-00000000c001",
  "causationId": null,
  "sagaId": null,
  "idempotencyKey": null,
  "payload": {
    "sku": "TSHIRT-BLK-M",
    "available": 3,
    "threshold": 5
  }
}
