{
  "messageId": "0192a1b2-0000-7000-8000-00000000a001",
  "messageKind": "event",
  "messageType": "UserRegistered",
  "messageVersion": 1,
  "producer": "ecommerce-auth-service",
  "occurredAt": "2026-10-13T09:30:00.000Z",
  "correlationId": "0192a1b2-0000-7000-8000-00000000c001",
  "causationId": null,
  "sagaId": null,
  "idempotencyKey": null,
  "payload": {
    "userId": "0192a1b2-0000-7000-8000-000000000101",
    "email": "asha@example.com",
    "fullName": "Asha Rao",
    "roles": [
      "customer"
    ]
  }
}
